4091213,ヤマナシケン,コウシュウシ,エンザンウシオク（５５３２−５５５０、オクノタカイタク、サガシオカイタク、サガシオオンセン）,山梨県,甲州市,塩山牛奥（５５３２〜５５５０、奥野田開拓、嵯峨塩開拓、嵯峨塩温泉）
4091211,ヤマナシケン,コウシュウシ,エンザンカミハギハラ（４０５１、４７８３、４７８４、スズランソウ、トウデンジョウブダム）,山梨県,甲州市,塩山上萩原（４０５１、４７８３、４７８４、すずらん荘、東電上部ダム）
4091212,ヤマナシケン,コウシュウシ,エンザンナカハギハラ（ヒカワコヤ）,山梨県,甲州市,塩山中萩原（日川小屋）
4091202,ヤマナシケン,コウシュウシ,ヤマトチョウタノ,山梨県,甲州市,大和町田野
4091205,ヤマナシケン,コウシュウシ,ヤマトチョウツルセ,山梨県,甲州市,大和町鶴瀬
4091201,ヤマナシケン,コウシュウシ,ヤマトチョウトクサ,山梨県,甲州市,大和町木賊
4091203,ヤマナシケン,コウシュウシ,ヤマトチョウハジカノ,山梨県,甲州市,大和町初鹿野
4091204,ヤマナシケン,コウシュウシ,ヤマトチョウヒカゲ,山梨県,甲州市,大和町日影
